{
"catalogType": "AI_COMMERCE_AND_SERVICES_MANIFEST",
"catalogVersion": "3.1.0",

"schema": {
"format": "JSON",
"draft": "2020-12",
"schemaUrl": "https://www.desinahub.com/ai-catalog.schema.json"
},

"identity": {
"name": "DeSinaHub",
"alternateNames": [
"desinahub",
"DeSina Hub"
],
"entityType": "OnlineStore",
"platformType": "ecommerce_and_services_platform",

"description": {
  "ar": "DeSinaHub هي منصة للتسوق والخدمات عبر الإنترنت، تقدم الهواتف والإلكترونيات، أجهزة الكمبيوتر وملحقاتها، الأجهزة المنزلية، منتجات الأوتليت، الملابس الرياضية، الأزياء، الخدمات الصناعية والخدمات السياحية.",
  "en": "DeSinaHub is an online shopping and services platform offering mobiles and electronics, computers and accessories, home appliances, outlet products, sports wear, fashion, industrial services and tourism services."
},

"url": "https://www.desinahub.com/",
"canonicalUrl": "https://www.desinahub.com/",
"logo": "https://www.desinahub.com/logo.png",

"country": "EG",
"region": "EG",
"market": "Egypt",
"currency": "EGP",

"primaryLanguage": "ar",
"supportedLanguages": [
  "ar",
  "en"
]

},

"provider": {
"name": "DeSinaHub",
"url": "https://www.desinahub.com/",

"support": {
  "email": "support@desinahub.com"
},

"sales": {
  "email": "sales@desinahub.com"
}

},

"officialProfiles": {
"facebook": "https://www.facebook.com/desinahub",
"instagram": "https://www.instagram.com/desinahub",
"tiktok": "https://www.tiktok.com/@desinahub",
"youtube": "https://www.youtube.com/@desinahub",
"pinterest": "https://www.pinterest.com/desinahub",
"x": "https://x.com/desinahub"
},

"platform": {
"marketplaceType": "online_store_and_services",
"country": "EG",
"currency": "EGP",

"features": {
  "productDiscovery": true,
  "serviceDiscovery": true,
  "categoryDiscovery": true,
  "siteSearch": true,
  "shoppingCart": true,
  "checkout": true,
  "offers": true,
  "outlet": true,
  "services": true,
  "customerSupport": true,

  "accountSystem": false,
  "reviews": false,
  "wishlist": false,
  "subscriptions": false,
  "appointments": false,
  "bookings": false
}

},

"catalog": {
"id": "desinahub-main-catalog",

"name": {
  "ar": "كتالوج DeSinaHub",
  "en": "DeSinaHub Catalog"
},

"description": {
  "ar": "الكتالوج الرئيسي القابل للقراءة آليًا لمنتجات وخدمات وعروض DeSinaHub.",
  "en": "The primary machine-readable catalog of DeSinaHub products, services and offers."
},

"baseUrl": "https://www.desinahub.com/",

"entities": {
  "products": {
    "enabled": true,
    "endpoint": "https://www.desinahub.com/products"
  },

  "services": {
    "enabled": true,
    "endpoint": "https://www.desinahub.com/services"
  },

  "categories": {
    "enabled": true
  },

  "brands": {
    "enabled": false,
    "futureSupport": true
  },

  "vendors": {
    "enabled": false,
    "futureSupport": true
  },

  "offers": {
    "enabled": true
  },

  "outlet": {
    "enabled": true,
    "endpoint": "https://www.desinahub.com/outlet"
  }
}

},

"categories": [
{
"id": "mobiles-electronics",
"type": "product",
"name": {
"ar": "الموبايلات والإلكترونيات",
"en": "Mobiles and Electronics"
}
},
{
"id": "computers-accessories",
"type": "product",
"name": {
"ar": "الكمبيوتر وملحقاته",
"en": "Computers and Accessories"
}
},
{
"id": "home-appliances",
"type": "product",
"name": {
"ar": "الأجهزة المنزلية",
"en": "Home Appliances"
}
},
{
"id": "outlet",
"type": "product",
"name": {
"ar": "الأوتليت",
"en": "Outlet"
},
"url": "https://www.desinahub.com/outlet"
},
{
"id": "sports-wear",
"type": "product",
"name": {
"ar": "الملابس الرياضية",
"en": "Sports Wear"
}
},
{
"id": "fashion",
"type": "product",
"name": {
"ar": "الأزياء",
"en": "Fashion"
}
},
{
"id": "industrial-services",
"type": "service",
"name": {
"ar": "الخدمات الصناعية",
"en": "Industrial Services"
}
},
{
"id": "tourism-services",
"type": "service",
"name": {
"ar": "الخدمات السياحية",
"en": "Tourism Services"
}
}
],

"resources": {
"home": {
"id": "home",
"type": "website",
"url": "https://www.desinahub.com/",
"access": "public",
"readOnly": true
},

"products": {
  "id": "products",
  "type": "catalog",
  "url": "https://www.desinahub.com/products",
  "method": "GET",
  "contentType": "text/html",
  "access": "public",
  "readOnly": true
},

"services": {
  "id": "services",
  "type": "catalog",
  "url": "https://www.desinahub.com/services",
  "method": "GET",
  "contentType": "text/html",
  "access": "public",
  "readOnly": true
},

"outlet": {
  "id": "outlet",
  "type": "catalog",
  "url": "https://www.desinahub.com/outlet",
  "method": "GET",
  "contentType": "text/html",
  "access": "public",
  "readOnly": true
},

"search": {
  "id": "search",
  "type": "search",
  "url": "https://www.desinahub.com/search",
  "method": "GET",
  "contentType": "text/html",
  "access": "public",
  "readOnly": true,

  "parameters": {
    "query": {
      "type": "string",
      "required": true
    },
    "category": {
      "type": "string",
      "required": false
    }
  }
},

"cart": {
  "id": "cart",
  "type": "shopping_cart",
  "url": "https://www.desinahub.com/cart",
  "method": "GET",
  "access": "public",
  "readOnly": false,
  "requiresUserInteraction": true
},

"checkout": {
  "id": "checkout",
  "type": "checkout",
  "url": "https://www.desinahub.com/checkout",
  "method": "GET",
  "access": "public",
  "readOnly": false,
  "requiresUserInteraction": true,
  "requiresConfirmation": true
},

"privacyPolicy": {
  "id": "privacy-policy",
  "type": "policy",
  "access": "public",
  "readOnly": true,
  "url": null
},

"terms": {
  "id": "terms",
  "type": "policy",
  "access": "public",
  "readOnly": true,
  "url": null
},

"returns": {
  "id": "returns-policy",
  "type": "policy",
  "access": "public",
  "readOnly": true,
  "url": null
},

"shippingPolicy": {
  "id": "shipping-policy",
  "type": "policy",
  "access": "public",
  "readOnly": true,
  "url": null
}

},

"productModel": {
"entityType": "Product",

"fields": {
  "id": {
    "type": "string",
    "required": true,
    "stable": true
  },

  "sku": {
    "type": "string",
    "required": false,
    "stable": true
  },

  "name": {
    "type": "localized_string",
    "required": true
  },

  "description": {
    "type": "localized_string",
    "required": false
  },

  "url": {
    "type": "url",
    "required": true
  },

  "image": {
    "type": "url",
    "required": false
  },

  "category": {
    "type": "category_id",
    "required": true
  },

  "brand": {
    "type": "string",
    "required": false
  },

  "price": {
    "type": "money",
    "required": true
  },

  "availability": {
    "type": "availability",
    "required": true
  },

  "condition": {
    "type": "condition",
    "required": false
  },

  "offer": {
    "type": "offer_reference",
    "required": false
  },

  "updatedAt": {
    "type": "datetime",
    "required": false
  }
}

},

"serviceModel": {
"entityType": "Service",

"fields": {
  "id": {
    "type": "string",
    "required": true,
    "stable": true
  },

  "name": {
    "type": "localized_string",
    "required": true
  },

  "description": {
    "type": "localized_string",
    "required": false
  },

  "category": {
    "type": "category_id",
    "required": true
  },

  "url": {
    "type": "url",
    "required": true
  },

  "availability": {
    "type": "availability",
    "required": false
  },

  "contactRequired": {
    "type": "boolean",
    "required": false
  },

  "bookingRequired": {
    "type": "boolean",
    "required": false
  },

  "price": {
    "type": "money",
    "required": false
  },

  "updatedAt": {
    "type": "datetime",
    "required": false
  }
}

},

"brandModel": {
"entityType": "Brand",
"futureSupport": true,

"fields": [
  "id",
  "name",
  "logo",
  "url",
  "description"
]

},

"vendorModel": {
"entityType": "Vendor",
"futureSupport": true,

"fields": [
  "id",
  "name",
  "logo",
  "url",
  "description",
  "verificationStatus"
]

},

"offerModel": {
"entityType": "Offer",

"fields": {
  "id": "string",
  "name": "localized_string",
  "description": "localized_string",
  "type": "offer_type",
  "value": "number",
  "currency": "currency",
  "validFrom": "datetime",
  "validUntil": "datetime",
  "productIds": "array",
  "categoryIds": "array",
  "termsUrl": "url"
}

},

"entityRelationships": {
"supported": true,

"relationships": [
  "product_belongs_to_category",
  "product_has_brand",
  "product_has_offer",
  "service_belongs_to_category",
  "offer_applies_to_product",
  "offer_applies_to_category",
  "vendor_provides_product",
  "vendor_provides_service"
]

},

"inventory": {
"enabled": true,

"availabilityValues": [
  "in_stock",
  "out_of_stock",
  "low_stock",
  "preorder",
  "unknown"
],

"policy": {
  "mustVerifyBeforePurchase": true,
  "sourceOfTruth": "official_product_page",
  "unknownValuesMustNotBeInferred": true
}

},

"pricing": {
"currency": "EGP",

"priceTypes": [
  "regular",
  "sale",
  "outlet",
  "promotional"
],

"policy": {
  "priceMustBeVerifiedBeforeCheckout": true,
  "currencyMustBeExplicit": true,
  "stalePriceMustNotBeAssumedCurrent": true
}

},

"offers": {
"enabled": true,

"types": [
  "discount",
  "sale",
  "outlet",
  "promotion",
  "bundle"
],

"policy": {
  "validityMustBeChecked": true,
  "termsMustBeChecked": true
}

},

"shopping": {
"cart": {
"enabled": true,
"url": "https://www.desinahub.com/cart",

  "operations": {
    "view": true,
    "add": true,
    "remove": true,
    "updateQuantity": true,
    "clear": true
  }
},

"checkout": {
  "enabled": true,
  "url": "https://www.desinahub.com/checkout",

  "operations": {
    "review": true,
    "submit": true
  },

  "humanConfirmationRequired": true
}

},

"orders": {
"enabled": true,

"lifecycle": [
  "cart",
  "checkout",
  "order_review",
  "order_submission",
  "payment",
  "processing",
  "fulfillment",
  "completed"
],

"autonomousOrderCreation": false,
"humanConfirmationRequired": true

},

"payments": {
"enabled": false,
"status": "integration_pending",

"potentialProviders": [
  "Paymob",